{
  "$schema": "https://json-schema.org/draft/2020-12/schema",
  "$id": "https://contracts.example.cn/novel-adaptation/ai/settings.schema.json",
  "title": "Settings AI stage response",
  "type": "object", "additionalProperties": false,
  "required": ["contractVersion", "jobId", "stage", "projectId", "chapterId", "sourceVersionId", "upstreamConfirmedVersionIds", "status", "items"],
  "properties": {
    "contractVersion": { "const": "0.1.0" }, "jobId": { "type": "string" }, "stage": { "const": "settings" }, "projectId": { "type": "string" },
    "chapterId": { "type": "string" }, "sourceVersionId": { "type": "string" }, "upstreamConfirmedVersionIds": { "type": "array", "minItems": 1, "items": { "type": "string" } },
    "status": { "enum": ["succeeded", "partially_succeeded", "failed"] }, "items": { "type": "array", "items": { "$ref": "#/$defs/itemResult" } }
  },
  "$defs": {
    "provenance": { "oneOf": [
      { "type": "object", "additionalProperties": false, "required": ["type", "sourceVersionId", "fragmentId", "transformation"], "properties": { "type": { "const": "source_fragment" }, "sourceVersionId": { "type": "string" }, "fragmentId": { "type": "string" }, "transformation": { "enum": ["retained", "compressed", "merged", "visualized", "actionized", "narrated", "sonified"] } } },
      { "type": "object", "additionalProperties": false, "required": ["type", "additionId"], "properties": { "type": { "const": "approved_addition" }, "additionId": { "type": "string" } } }
    ] },
    "asset": { "type": "object", "additionalProperties": false, "required": ["id", "assetType", "name", "visibleDefinition", "state", "stateChanges", "restrictions", "provenance"], "properties": {
      "id": { "type": "string" }, "assetType": { "enum": ["character", "location", "prop", "visualStyle"] }, "name": { "type": "string", "minLength": 1 },
      "visibleDefinition": { "type": "object", "minProperties": 1 }, "state": { "type": "string" }, "stateChanges": { "type": "array", "items": { "type": "string" } },
      "restrictions": { "type": "array", "items": { "type": "string" } }, "provenance": { "type": "array", "minItems": 1, "items": { "$ref": "#/$defs/provenance" } }
    } },
    "failure": { "type": "object", "additionalProperties": false, "required": ["code", "message", "retryable"], "properties": { "code": { "type": "string" }, "message": { "type": "string" }, "retryable": { "type": "boolean" } } },
    "itemResult": { "oneOf": [
      { "type": "object", "additionalProperties": false, "required": ["scopeKey", "status", "value"], "properties": { "scopeKey": { "type": "string" }, "status": { "const": "succeeded" }, "value": { "$ref": "#/$defs/asset" } } },
      { "type": "object", "additionalProperties": false, "required": ["scopeKey", "status", "error"], "properties": { "scopeKey": { "type": "string" }, "status": { "const": "failed" }, "error": { "$ref": "#/$defs/failure" } } }
    ] }
  }
}
