{"contractVersion":"0.1.0","jobId":"job_set1","stage":"settings","projectId":"prj_u1","chapterId":"chp_u1","sourceVersionId":"srcv_u1","upstreamConfirmedVersionIds":["cv_uk1","cv_us1"],"status":"succeeded","items":[{"scopeKey":"asset:phone","status":"succeeded","value":{"id":"asset_u1","assetType":"prop","name":"手机","visibleDefinition":{"material":"glass"},"state":"亮屏","stateChanges":[],"restrictions":["不得显示未知来电号码"],"provenance":[{"type":"source_fragment","sourceVersionId":"srcv_u1","fragmentId":"frag_u1","transformation":"retained"}]}}]}
